title,author,date,thumb,excerpt,article_url,website_name
Bitcoin: Still Prevalent and Here’s Why,NewsBTC, 19 hours ago,https://www.newsbtc.com/wp-content/uploads/2023/10/bitcoin-3137984_1280.jpg?resize=350%2C250,"Bitcoin has been around since early 2009 and despite its ups and downs along the way the coin is now worth more than $27,000. The coin’s volatility may have been...",https://www.newsbtc.com/news/company/bitcoin-still-prevalent-and-heres-why/,NEWSBTC
What To Expect If Historical Bitcoin Halving Cycles Repeat,Scott Matherson, 1 day ago,https://www.newsbtc.com/wp-content/uploads/2023/10/Bitcoin-halving-1.jpeg?resize=350%2C250,"It's been quite a bearish week for Bitcoin, as the crypto has fallen around 3% since the beginning of the week. Price action, in particular, has had Bitcoin struggling to...",https://www.newsbtc.com/news/bitcoin/historical-bitcoin-halving-cycles/,NEWSBTC
"This Trader Is On The Brink Of Losing Money, Will Selling WBTC On Aave V2 Help?",Dalmas Ngetich, 1 day ago,https://www.newsbtc.com/wp-content/uploads/2023/10/Crypto-news-Template70.jpg?resize=350%2C250,"A trader on Aave, a decentralized liquidity protocol operating on multiple platforms, including Ethereum and OP Mainnet, has begun selling wrapped Bitcoin (WBTC) to repay outstanding debt, records on October 13 reveal....",https://www.newsbtc.com/news/trader-brink-losing-money-selling-wbtc-aave/,NEWSBTC
"Cardano (ADA) Addresses In Loss Rise Over 94%, Is It Time To Jump Ship?",Scott Matherson, 1 day ago,https://www.newsbtc.com/wp-content/uploads/2023/10/Cardano-ADA.jpeg?resize=350%2C250,"Cardano is down 45.6% from its yearly high of $0.4518 and is showing no signs of slowing down at the moment. Data has shown that at its current price, the...",https://www.newsbtc.com/news/cardano/cardano-ada-addresses-loss/,NEWSBTC
Man Makes A Fortune With $22 In Bitcoin: 3 Altcoins For October 2023 That Can Do This,Scott Matherson, 1 day ago,https://www.newsbtc.com/wp-content/uploads/2023/10/Bitcoin-altcoins-crypto.jpeg?resize=350%2C250,"Bitcoin’s history is filled with stories of people who put small, disposable amounts of money into the crypto and ended up making a fortune. This has been no different from...",https://www.newsbtc.com/altcoin/bitcoin-3-altcoins-october/,NEWSBTC
Failed Bullish Pattern Could Send Ethereum Sub-$1000,"Tony ""The Bull"" Severino", 2 days ago,https://www.newsbtc.com/wp-content/uploads/2023/10/shutterstock_1822493420.jpg?resize=350%2C250,"Ethereum price is trading at roughly $1,550 after failing to get back above $2,000 throughout the entirety of 2023 thus far. Increasingly higher lows during the year and a horizontal...",https://www.newsbtc.com/news/ethereum/failed-bullish-ethereum-sub-1000/,NEWSBTC
"Cardano, Solana, And Ethereum Under Heat, Data Points To More Trouble For Altcoins",Reynaldo Marquez, 2 days ago,https://www.newsbtc.com/wp-content/uploads/2023/10/Cardano-price-ADAUSDT-ADA-Solana-price-SOL-price-SOLUSDT.jpg?resize=350%2C250,"Bulls pushed back and momentarily halted the increasing selling pressure impacting Cardano, Solana, and Ethereum. The altcoin market has been stabilizing over the last day, but fresh data points to...",https://www.newsbtc.com/news/cardano/cardano-solana-and-ethereum-under-heat-data-points-to-more-trouble-for-altcoins/,NEWSBTC
Crypto Analyst Breaks Down The Factors Behind The Bitcoin Price Decline,Scott Matherson, 2 days ago,https://www.newsbtc.com/wp-content/uploads/2023/10/Bitcoin-.jpeg?resize=350%2C250,"As the bear market continues to linger, analysts have weighed in on the decline of the flagship cryptocurrency, Bitcoin, and the crypto market, by extension. This time, another crypto analyst...",https://www.newsbtc.com/news/bitcoin/factors-behind-bitcoin-decline/,NEWSBTC
Top Rated Tether (USDT) Casinos,NewsBTC, 2 days ago,https://www.newsbtc.com/wp-content/uploads/2023/10/cards-166436_1280.jpg?resize=350%2C250,Cryptocurrencies pushed online gambling to a new frontier. But their unstable market price is a constant danger for all crypto bankrolls. That’s where stablecoins jump in. These cryptos maintain a...,https://www.newsbtc.com/news/company/top-rated-tether-usdt-casinos/,NEWSBTC
"Analyst Predicts Next Bitcoin Cycle Top – Is It $89,000 Or $135,000?",Jake Simmons, 2 days ago,https://www.newsbtc.com/wp-content/uploads/2023/10/shutterstock_1922249036.jpg?resize=350%2C250,"The cryptocurrency landscape is once again rife with speculation as Bitcoin traverses its current fourth halving cycle. Amidst varied predictions, renowned crypto analyst CryptoCon's insights, grounded in the Gann Square...",https://www.newsbtc.com/news/bitcoin/analyst-bitcoin-cycle-top-89000-135000/,NEWSBTC
